{
  "config_version": 2,
  "perimeter": "DESENVOLVIMENTO",
  "scope": "Exemplo de contextos Windows distintos",
  "source": {
    "role": "data_provider",
    "instance": "SQL-ORIGEM\\INST01",
    "port": 1433,
    "database": "BD_ORIGEM",
    "schema": "ESQUEMA_ORIGEM",
    "authentication": {
      "type": "windows_credentials",
      "domain": "DOMINIO_A",
      "username": "svc_leitura",
      "password": {"provider": "prompt", "reference": null}
    }
  },
  "bronze_destination": {
    "role": "structure_and_data",
    "instance": "SQL-DESTINO-01\\INST01",
    "port": 1433,
    "database": "BD_DESTINO_01",
    "schema": "fonte_a",
    "structure_profile": "bronze",
    "authentication": {
      "type": "windows_credentials",
      "domain": "DOMINIO_B",
      "username": "svc_carga",
      "password": {"provider": "windows_credential_manager", "reference": "BCP/load-service"}
    }
  },
  "landing_destination": {
    "role": "structure_only",
    "instance": "SQL-DESTINO-02\\INST03",
    "port": 1433,
    "database": "BD_DESTINO_02",
    "schema": "fonte_a",
    "structure_profile": "landing_without_aud",
    "authentication": {
      "type": "windows_credentials",
      "domain": "DOMINIO_C",
      "username": "svc_estrutura",
      "password": {"provider": "windows_credential_manager", "reference": "BCP/structure-service"}
    }
  },
  "active_destination": "bronze",
  "execute_import": true,
  "cdc_retention_minutes": 262800,
  "executor_directory": "\\\\SERVIDOR_ARQUIVOS\\COMPARTILHAMENTO\\bcp-data",
  "destination_sql_directory": "\\\\SERVIDOR_ARQUIVOS\\COMPARTILHAMENTO\\bcp-data",
  "local_control_directory": "C:\\CAMINHO_DO_PROJETO\\Local\\BulkFlow\\.bcp-control",
  "tables": [
    {"source_table": "TABELA_ORIGEM_01", "destination_table": "bd_origem_tabela_origem_01", "watermark": null}
  ]
}
