{
  "config_version": 2,
  "perimeter": "DESENVOLVIMENTO",
  "scope": "Exemplo de executor Linux com autenticação SQL",
  "source": {
    "role": "data_provider",
    "instance": "sql-source.example.internal",
    "port": 1433,
    "database": "BD_ORIGEM",
    "schema": "ESQUEMA_ORIGEM",
    "authentication": {
      "type": "sql",
      "username": "login_leitura",
      "password": {"provider": "env", "reference": "BCP_SOURCE_SQL_PASSWORD"}
    }
  },
  "bronze_destination": {
    "role": "structure_and_data",
    "instance": "sql-target.example.internal",
    "port": 1433,
    "database": "BD_DESTINO_01",
    "schema": "fonte_a",
    "structure_profile": "bronze",
    "authentication": {
      "type": "sql",
      "username": "login_carga",
      "password": {"provider": "env", "reference": "BCP_BRONZE_SQL_PASSWORD"}
    }
  },
  "landing_destination": {
    "role": "structure_only",
    "instance": "sql-destination-02.example.internal",
    "port": 1433,
    "database": "BD_DESTINO_02",
    "schema": "fonte_a",
    "structure_profile": "landing_without_aud",
    "authentication": {
      "type": "sql",
      "username": "login_estrutura",
      "password": {"provider": "env", "reference": "BCP_LANDING_SQL_PASSWORD"}
    }
  },
  "active_destination": "bronze",
  "execute_import": true,
  "cdc_retention_minutes": 262800,
  "create_structure_if_needed": true,
  "executor_directory": "/var/lib/bcp-engine/artifacts",
  "destination_sql_directory": "/var/opt/mssql/bcp",
  "local_control_directory": "/var/lib/bcp-engine/control",
  "bcp_executable": "/opt/mssql-tools18/bin/bcp",
  "delete_confirmed_files": false,
  "tables": [
    {
      "source_table": "TABELA_ORIGEM_01",
      "destination_table": "bd_origem_tabela_origem_01",
      "enable_cdc": false,
      "watermark": null
    }
  ]
}
