{
  "config_version": 2,
  "perimeter": "DESENVOLVIMENTO",
  "scope": "Exemplo de criação e evolução estrutural do BD_DESTINO_02, sem carga de dados",
  "source": {
    "role": "data_provider",
    "instance": "SQL-ORIGEM\\INST01",
    "port": 1433,
    "database": "BD_ORIGEM",
    "schema": "ESQUEMA_ORIGEM",
    "authentication": {"type": "windows_integrated"}
  },
  "landing_destination": {
    "role": "structure_only",
    "instance": "SQL-DESTINO-02\\INST01",
    "port": 1433,
    "database": "BD_DESTINO_02",
    "schema": "esquema_destino",
    "structure_profile": "../templates/landing_without_aud.json",
    "authentication": {"type": "windows_integrated"}
  },
  "active_destination": "bronze",
  "execute_import": false,
  "cdc_retention_minutes": 262800,
  "executor_directory": "C:\\CAMINHO_DO_PROJETO\\Local\\BulkFlow\\bcp-data",
  "local_control_directory": "C:\\CAMINHO_DO_PROJETO\\Local\\BulkFlow\\.bcp-control",
  "tables": [
    {
      "source_table": "TABELA_ORIGEM_01",
      "destination_table": "bd_origem_tabela_origem_01",
      "structure_profile": "../templates/landing_without_aud.json",
      "watermark": null
    }
  ]
}
