{
  "config_version": 2,
  "perimeter": "DESENVOLVIMENTO",
  "scope": "Exemplo completo com lote de homologação de 1.500 linhas; o default do produto é 200.000",
  "source": {
    "role": "data_provider",
    "instance": "SQL-ORIGEM\\INST01",
    "port": 1433,
    "database": "BD_ORIGEM",
    "read_database": "BD_ORIGEM",
    "schema": "ESQUEMA_ORIGEM",
    "authentication": {"type": "windows_integrated"}
  },
  "bronze_destination": {
    "role": "structure_and_data",
    "instance": "SQL-DESTINO-01\\INST01",
    "port": 1433,
    "database": "BD_DESTINO_01",
    "schema": "esquema_destino",
    "structure_profile": "bronze",
    "authentication": {"type": "windows_integrated"}
  },
  "landing_destination": {
    "role": "structure_only",
    "instance": "SQL-DESTINO-02\\INST01",
    "port": 1433,
    "database": "BD_DESTINO_02",
    "schema": "esquema_destino",
    "structure_profile": "landing_without_aud",
    "authentication": {"type": "windows_integrated"}
  },
  "active_destination": "bronze",
  "execute_import": true,
  "create_structure_if_needed": true,
  "executor_directory": "C:\\CAMINHO_DO_PROJETO\\Local\\BulkFlow\\bcp-data",
  "destination_sql_directory": "C:\\CAMINHO_DO_PROJETO\\Local\\BulkFlow\\bcp-data",
  "local_control_directory": "C:\\CAMINHO_DO_PROJETO\\Local\\BulkFlow\\.bcp-control",
  "rows_per_block": 1500,
  "keyless_direct_load_max_rows": 5000000,
  "allow_schema_evolution": false,
  "cdc_retention_minutes": 262800,
  "max_file_bytes": 2147483648,
  "minimum_free_space_bytes": 10737418240,
  "delete_confirmed_files": true,
  "continue_after_table_error": true,
  "odbc_driver": "ODBC Driver 18 for SQL Server",
  "bcp_executable": "bcp",
  "connection_timeout_seconds": 30,
  "sql_timeout_seconds": 0,
  "bcp_timeout_seconds": 0,
  "control_schema": "dbo",
  "tls": {
    "encrypt": true,
    "trust_server_certificate": false,
    "bcp_switch": "-Ym"
  },
  "estimates": {
    "row_count_method": "metadata",
    "maximum_sample_rows": 10000,
    "safety_factor": 1.25,
    "on_unavailable": "stop"
  },
  "batching": {
    "null_policy": "reject_table",
    "tie_policy": "complete_group",
    "upper_bound_policy": "capture_at_table_start",
    "require_watermark_index": false
  },
  "structure": {"secondary_indexes_phase": "after_table_load"},
  "bronze_event_id": {
    "strategy": "sequence",
    "sequence_name": "seq_{destination_table}",
    "source_column": null
  },
  "tables": [
    {"source_table": "TABELA_ORIGEM_01", "destination_table": "bd_origem_tabela_origem_01", "enable_cdc": true, "watermark": null},
    {"source_table": "TABELA_ORIGEM_02", "destination_table": "bd_origem_tabela_origem_02", "enable_cdc": true, "watermark": null},
    {
      "source_table": "TABELA_ORIGEM_03",
      "destination_table": "bd_origem_tabela_origem_03",
      "enable_cdc": true,
      "watermark": {
        "columns": [{"name": "COLUNA_MARCA_DAGUA", "direction": "ASC"}]
      }
    }
  ]
}
